{
  "$id": "https://graphnode.dev/schemas/conversation.json",
  "$schema": "https://json-schema.org/draft/2020-12/schema",
  "title": "ChatThread",
  "type": "object",
  "required": ["id", "title", "updatedAt", "messages"],
  "properties": {
    "id": { "type": "string", "description": "FE가 생성한 UUID/ULID" },
    "title": { "type": "string", "minLength": 1, "maxLength": 200 },
    "updatedAt": { "type": "string", "format": "date-time" },
    "deletedAt": { "type": ["string", "null"], "format": "date-time" },
    "messages": {
      "type": "array",
      "items": { "$ref": "./message.json" }
    },
    "score": { "type": "number", "description": "Search relevance score" }
  },
  "additionalProperties": false
}
