{
  "id": "c_1234567890abcdef",
  "title": "New Conversation",
  "updatedAt": "2025-01-01T12:00:05Z",
  "messages": [
    {
      "id": "m_1111111111aaaaaa",
      "role": "user",
      "content": "Hello there",
      "ts": "2025-01-01T12:00:00Z"
    },
    {
      "id": "m_bbbbbbbbbbbb2222",
      "role": "assistant",
      "content": "Hi! How can I help?",
      "ts": "2025-01-01T12:00:03Z"
    }
  ]
}